{
  "dataset_id": "patient_prot",
  "status": "available",
  "unavailable_reason": null,
  "context": "patient",
  "species": "Homo sapiens",
  "modality": "protein",
  "provenance": {
    "synthetic": true,
    "origin": "bench/gen_fixtures.py from bench/spec.json (synthetic)",
    "modified_fields": [],
    "original_path": null
  },
  "observations": [
    {
      "observation_id": "obs_patient_protein_tyk2",
      "gene": "TYK2",
      "tissue": "skin, lesional plaque (full-thickness punch biopsy)",
      "model_or_cohort": "12 adults with plaque psoriasis, paired lesional/non-lesional 4 mm punch biopsies, baseline visit",
      "contrast": {
        "name": "lesional_vs_nonlesional",
        "case": "lesional plaque biopsy",
        "reference": "non-lesional biopsy, same participant, same visit",
        "alignment_basis": null
      },
      "endpoint": "protein abundance (Olink NPX, log2 scale)",
      "method": "Olink Explore 3072, NPX, paired t-test",
      "effect": {
        "log2fc": 0.828,
        "padj": 0.003,
        "direction": "up",
        "n_case": 12,
        "n_reference": 12,
        "aggregate_of": "samples"
      },
      "samples": [
        {
          "participant_id": "P01",
          "specimen_id": "S-P01-NL",
          "timepoint": "baseline",
          "arm": "reference",
          "value": 5.327
        },
        {
          "participant_id": "P01",
          "specimen_id": "S-P01-L",
          "timepoint": "baseline",
          "arm": "case",
          "value": 6.051
        },
        {
          "participant_id": "P02",
          "specimen_id": "S-P02-NL",
          "timepoint": "baseline",
          "arm": "reference",
          "value": 5.15
        },
        {
          "participant_id": "P02",
          "specimen_id": "S-P02-L",
          "timepoint": "baseline",
          "arm": "case",
          "value": 5.926
        },
        {
          "participant_id": "P03",
          "specimen_id": "S-P03-NL",
          "timepoint": "baseline",
          "arm": "reference",
          "value": 4.441
        },
        {
          "participant_id": "P03",
          "specimen_id": "S-P03-L",
          "timepoint": "baseline",
          "arm": "case",
          "value": 5.368
        },
        {
          "participant_id": "P04",
          "specimen_id": "S-P04-NL",
          "timepoint": "baseline",
          "arm": "reference",
          "value": 4.735
        },
        {
          "participant_id": "P04",
          "specimen_id": "S-P04-L",
          "timepoint": "baseline",
          "arm": "case",
          "value": 5.667
        },
        {
          "participant_id": "P05",
          "specimen_id": "S-P05-NL",
          "timepoint": "baseline",
          "arm": "reference",
          "value": 5.447
        },
        {
          "participant_id": "P05",
          "specimen_id": "S-P05-L",
          "timepoint": "baseline",
          "arm": "case",
          "value": 6.163
        },
        {
          "participant_id": "P06",
          "specimen_id": "S-P06-NL",
          "timepoint": "baseline",
          "arm": "reference",
          "value": 5.434
        },
        {
          "participant_id": "P06",
          "specimen_id": "S-P06-L",
          "timepoint": "baseline",
          "arm": "case",
          "value": 6.094
        },
        {
          "participant_id": "P07",
          "specimen_id": "S-P07-NL",
          "timepoint": "baseline",
          "arm": "reference",
          "value": 4.898
        },
        {
          "participant_id": "P07",
          "specimen_id": "S-P07-L",
          "timepoint": "baseline",
          "arm": "case",
          "value": 5.676
        },
        {
          "participant_id": "P08",
          "specimen_id": "S-P08-NL",
          "timepoint": "baseline",
          "arm": "reference",
          "value": 5.669
        },
        {
          "participant_id": "P08",
          "specimen_id": "S-P08-L",
          "timepoint": "baseline",
          "arm": "case",
          "value": 6.63
        },
        {
          "participant_id": "P09",
          "specimen_id": "S-P09-NL",
          "timepoint": "baseline",
          "arm": "reference",
          "value": 4.352
        },
        {
          "participant_id": "P09",
          "specimen_id": "S-P09-L",
          "timepoint": "baseline",
          "arm": "case",
          "value": 5.035
        },
        {
          "participant_id": "P10",
          "specimen_id": "S-P10-NL",
          "timepoint": "baseline",
          "arm": "reference",
          "value": 4.396
        },
        {
          "participant_id": "P10",
          "specimen_id": "S-P10-L",
          "timepoint": "baseline",
          "arm": "case",
          "value": 5.3
        },
        {
          "participant_id": "P11",
          "specimen_id": "S-P11-NL",
          "timepoint": "baseline",
          "arm": "reference",
          "value": 4.484
        },
        {
          "participant_id": "P11",
          "specimen_id": "S-P11-L",
          "timepoint": "baseline",
          "arm": "case",
          "value": 5.243
        },
        {
          "participant_id": "P12",
          "specimen_id": "S-P12-NL",
          "timepoint": "baseline",
          "arm": "reference",
          "value": 4.1
        },
        {
          "participant_id": "P12",
          "specimen_id": "S-P12-L",
          "timepoint": "baseline",
          "arm": "case",
          "value": 5.215
        }
      ],
      "cohort_summary": {
        "n_participants": 12,
        "age_mean": 44.1,
        "sex_ratio_f": 0.5,
        "site": "Site A",
        "visit": "baseline"
      }
    }
  ]
}
