{
  "dataset_id": "patient_rna",
  "status": "available",
  "unavailable_reason": null,
  "context": "patient",
  "species": "Homo sapiens",
  "modality": "rna",
  "provenance": {
    "synthetic": true,
    "origin": "bench/gen_fixtures.py from bench/spec.json (synthetic)",
    "modified_fields": [],
    "original_path": null
  },
  "observations": [
    {
      "observation_id": "obs_patient_rna_tyk2",
      "gene": "TYK2",
      "tissue": "skin, lesional plaque (full-thickness punch biopsy)",
      "model_or_cohort": "12 adults with plaque psoriasis, paired lesional/non-lesional 4 mm punch biopsies, baseline visit",
      "contrast": {
        "name": "lesional_vs_nonlesional",
        "case": "lesional plaque biopsy",
        "reference": "non-lesional biopsy, same participant, same visit",
        "alignment_basis": "disease-vs-reference tissue contrast in the target organ; endpoint comparable to the in-vitro mRNA endpoint"
      },
      "endpoint": "mRNA abundance (log2 CPM)",
      "method": "bulk RNA-seq, paired DESeq2",
      "effect": {
        "log2fc": 1.12,
        "padj": 0.0001,
        "direction": "up",
        "n_case": 12,
        "n_reference": 12,
        "aggregate_of": "samples"
      },
      "samples": [
        {
          "participant_id": "P01",
          "specimen_id": "S-P01-NL",
          "timepoint": "baseline",
          "arm": "reference",
          "value": 5.248
        },
        {
          "participant_id": "P01",
          "specimen_id": "S-P01-L",
          "timepoint": "baseline",
          "arm": "case",
          "value": 6.371
        },
        {
          "participant_id": "P02",
          "specimen_id": "S-P02-NL",
          "timepoint": "baseline",
          "arm": "reference",
          "value": 4.579
        },
        {
          "participant_id": "P02",
          "specimen_id": "S-P02-L",
          "timepoint": "baseline",
          "arm": "case",
          "value": 5.604
        },
        {
          "participant_id": "P03",
          "specimen_id": "S-P03-NL",
          "timepoint": "baseline",
          "arm": "reference",
          "value": 4.093
        },
        {
          "participant_id": "P03",
          "specimen_id": "S-P03-L",
          "timepoint": "baseline",
          "arm": "case",
          "value": 5.284
        },
        {
          "participant_id": "P04",
          "specimen_id": "S-P04-NL",
          "timepoint": "baseline",
          "arm": "reference",
          "value": 5.262
        },
        {
          "participant_id": "P04",
          "specimen_id": "S-P04-L",
          "timepoint": "baseline",
          "arm": "case",
          "value": 6.35
        },
        {
          "participant_id": "P05",
          "specimen_id": "S-P05-NL",
          "timepoint": "baseline",
          "arm": "reference",
          "value": 4.181
        },
        {
          "participant_id": "P05",
          "specimen_id": "S-P05-L",
          "timepoint": "baseline",
          "arm": "case",
          "value": 5.056
        },
        {
          "participant_id": "P06",
          "specimen_id": "S-P06-NL",
          "timepoint": "baseline",
          "arm": "reference",
          "value": 5.909
        },
        {
          "participant_id": "P06",
          "specimen_id": "S-P06-L",
          "timepoint": "baseline",
          "arm": "case",
          "value": 7.146
        },
        {
          "participant_id": "P07",
          "specimen_id": "S-P07-NL",
          "timepoint": "baseline",
          "arm": "reference",
          "value": 4.651
        },
        {
          "participant_id": "P07",
          "specimen_id": "S-P07-L",
          "timepoint": "baseline",
          "arm": "case",
          "value": 5.7
        },
        {
          "participant_id": "P08",
          "specimen_id": "S-P08-NL",
          "timepoint": "baseline",
          "arm": "reference",
          "value": 4.66
        },
        {
          "participant_id": "P08",
          "specimen_id": "S-P08-L",
          "timepoint": "baseline",
          "arm": "case",
          "value": 5.66
        },
        {
          "participant_id": "P09",
          "specimen_id": "S-P09-NL",
          "timepoint": "baseline",
          "arm": "reference",
          "value": 5.098
        },
        {
          "participant_id": "P09",
          "specimen_id": "S-P09-L",
          "timepoint": "baseline",
          "arm": "case",
          "value": 6.138
        },
        {
          "participant_id": "P10",
          "specimen_id": "S-P10-NL",
          "timepoint": "baseline",
          "arm": "reference",
          "value": 4.851
        },
        {
          "participant_id": "P10",
          "specimen_id": "S-P10-L",
          "timepoint": "baseline",
          "arm": "case",
          "value": 6.138
        },
        {
          "participant_id": "P11",
          "specimen_id": "S-P11-NL",
          "timepoint": "baseline",
          "arm": "reference",
          "value": 4.491
        },
        {
          "participant_id": "P11",
          "specimen_id": "S-P11-L",
          "timepoint": "baseline",
          "arm": "case",
          "value": 5.521
        },
        {
          "participant_id": "P12",
          "specimen_id": "S-P12-NL",
          "timepoint": "baseline",
          "arm": "reference",
          "value": 5.274
        },
        {
          "participant_id": "P12",
          "specimen_id": "S-P12-L",
          "timepoint": "baseline",
          "arm": "case",
          "value": 6.77
        }
      ],
      "cohort_summary": {
        "n_participants": 12,
        "age_mean": 44.1,
        "sex_ratio_f": 0.5,
        "site": "Site A",
        "visit": "baseline"
      }
    }
  ]
}
